Título,Fecha de Publicación,URL
"Última hora de la dana, en directo | El número de fallecidos por la dana en la Comunidad Valenciana se eleva a 202 personas",2024-10-29,https://elpais.com/espana/2024-10-29/la-dana-en-espana-en-directo-ultimas-noticias-del-temporal-y-las-inundaciones.html
"Última hora de las inundaciones por la DANA en España, en directo: muertos, desaparecidos y carreteras cortadas en Madrid, Málaga, Albacete y Valencia hoy",2024-10-29,https://www.abc.es/sociedad/lluvias-torrenciales-espana-dana-directo-carreteras-cortadas-20241029092456-di.html
Directo | Al menos 202 personas fallecidas por la DANA en Valencia,2024-10-30,https://www.lne.es/sociedad/2024/10/30/directo-ultima-hora-dana-azota-costa-mediterranea-sur-peninsula-110836438.html
El Ejército se despliega en Valencia y los muertos a causa de la dana suman 158,2024-10-31,https://www.lavozdeasturias.es/noticia/actualidad/2024/10/31/ejercito-despliega-valencia-muertos-dana-suman-158/00031730414007961105587.htm
De Natalie Portman a Dua Lipa: el auge de los clubes de lectura de famosas,2024-10-31,https://librotea.eldiario.es/articulos/natalie-portman-dua-lipa-auge-clubes-lectura-famosas
"Última hora de la DANA en Valencia y España, en directo | 202 muertos y un número desconocido de desaparecidos por las inundaciones en Valencia",2024-11-01,https://www.elmundo.es/espana/2024/11/01/67246f931ee97cbdb6ed5b78-directo.html?intcmp=livefeed&catlivefeed=Directo
Suma y sigue: guardias civiles denuncian que no les dejan intervenir como voluntarios en Valencia,2024-11-01,https://www.larazon.es/espana/suma-sigue-guardias-civiles-denuncian-que-les-dejan-intervenir-como-voluntarios-valencia_202411016724bae4d8f8950001d73927.html
